{
  "$schema": "./schemas/package.schema.json",
  "name": "goldstack-email-send",
  "template": "email-send",
  "templateVersion": "0.1.0",
  "configuration": {},
  "deployments": [
    {
      "name": "dev",
      "awsRegion": "us-west-2",
      "awsUser": "goldstack-dev",
      "configuration": {
        "domain": "dev.goldstack.party",
        "hostedZoneDomain": "dev.goldstack.party"
      },
      "tfStateKey": "goldstack-email-send-dev-499ef4e27f7eed892f24.tfstate"
    },
    {
      "name": "prod",
      "awsRegion": "us-west-2",
      "awsUser": "goldstack-prod",
      "configuration": {
        "domain": "goldstack.party",
        "hostedZoneDomain": "goldstack.party"
      },
      "tfStateKey": "goldstack-email-send-prod-4178ace0fd1696262fb4.tfstate"
    }
  ]
}
