{
  "$schema": "./schemas/package.schema.json",
  "name": "email-send",
  "template": "email-send",
  "templateVersion": "0.1.0",
  "configuration": {},
  "deployments": [
    {
      "name": "prod",
      "awsRegion": "us-west-2",
      "awsUser": "goldstack-dev",
      "configuration": {
        "domain": "email-send.templates.dev.goldstack.party",
        "hostedZoneDomain": "dev.goldstack.party"
      }
    }
  ]
}
